{
  "eventId": "11111111-1111-4111-8111-111111111111",
  "eventType": "EstateCreated",
  "eventVersion": 1,
  "timestamp": "2026-10-23T12:00:00Z",
  "correlationId": "11111111-1111-4111-8111-111111111111",
  "source": "estate-service",
  "estateId": "11111111-1111-4111-8111-111111111111",
  "dataProvenance": "SIMULATED",
  "payload": {
    "companyId": "11111111-1111-4111-8111-111111111111",
    "name": "Sample rubber estate"
  }
}
