{
  "eventId": "11111111-1111-4111-8111-111111111111",
  "eventType": "YieldForecastGenerated",
  "eventVersion": 1,
  "timestamp": "2026-10-23T12:00:00Z",
  "correlationId": "11111111-1111-4111-8111-111111111111",
  "source": "ai-service",
  "estateId": "11111111-1111-4111-8111-111111111111",
  "blockId": "22222222-2222-4222-8222-222222222222",
  "dataProvenance": "PREDICTED",
  "payload": {
    "forecastId": "11111111-1111-4111-8111-111111111111",
    "periodStart": "2026-10-23",
    "periodEnd": "2026-10-30",
    "predictedDryRubberKg": 1,
    "modelVersion": "Sample rubber estate",
    "evidenceIds": [
      "11111111-1111-4111-8111-111111111111"
    ]
  }
}
