{
  "eventId": "11111111-1111-4111-8111-111111111111",
  "eventType": "TappingActivityRecorded",
  "eventVersion": 1,
  "timestamp": "2026-10-23T12:00:00Z",
  "correlationId": "11111111-1111-4111-8111-111111111111",
  "source": "operations-service",
  "estateId": "11111111-1111-4111-8111-111111111111",
  "blockId": "22222222-2222-4222-8222-222222222222",
  "dataProvenance": "SIMULATED",
  "payload": {
    "activityId": "11111111-1111-4111-8111-111111111111",
    "tappedAt": "2026-10-23T12:00:00Z",
    "tappedTreeCount": 1
  }
}
